"Michigan Swim Camp, LLC","https://www.wolverineswimcamp.com","umswim1@gmail.com","8160 Valley View Dr.","Ypsilanti","MI",48197,"734-845-8596","Join us next summer for the 2015 Michigan Swim Camp! Our Olympian and NCAA All-American staff are looking forward to meeting you! We offer clinics as well as camps. These clinics are designed to make significant improvements in stroke, start, and turn techniques.  It is our belief that technical efficiency is the fastest way to make time improvements.",8,18,"Yes","Yes","No","Swimming",,,,,,,,,185,"Per_session","Active","https://www.facebook.com/wolverineswimcamp","No","https://www.wolverineswimcamp.com/templates/theme595/images/logo.png","https://scontent-a-lga.xx.fbcdn.net/hphotos-xfa1/v/t1.0-9/1798518_586494631447077_2089073431_n.jpg?oh=016483df971754a2c2f85482aee81cbb&oe=55164AB2",,,,,
"Baylor Acrobatics and Tumbling","baylor.edu","Emily_maike@baylor.edu","1311 S 5th St","Waco","TX",76798,"254-710-3281","Baylor acrobatics and tumbling camps/clinics are perfect for female athletes that are competing at all levels of competitive cheerleading, gymnastics and tumbling and eventually would like to continue their careers at the collegiate level.",8,18,"No","Yes","No","Gymnastics",,,,,,,,,100,"Per_session","unclear","https://www.facebook.com/BaylorAthletics","Yes","https://fbcdn-profile-a.akamaihd.net/hprofile-ak-xap1/v/t1.0-1/p160x160/10388572_10152543443209497_2754336738981267785_n.jpg?oh=5eaf87ccda1f3aacf416e92e035a446d&oe=54E89116&__gda__=1423662019_ecd68e335896ec0f7427e593b306fa07",,,,,,
"Charleston Battery","charlestonbattery.com","bentley.wynns@charlestonbattery.com","1990 Daniel Island Drive","Charleston","SC",29492,"843-971-4625","Under the overall direction of Charleston Battery head coach Mike Anhaeuser, Summer Camp and Academy coaches include current and former Charleston Battery players. Summer camps are directed by former Charleston Battery player Temoc Suarez, Suarez Soccer School. All camps have a staff to camper ratio of 1:12. The Charleston Battery Day Camp is offered as a week-long camp for boys and girls ages 5-12. The Charleston Battery Junior Academy is aimed toward advanced dedicated soccer player’s ages 7-14 looking for an extended summer program. Tiny Tots is for children ages 3-6,",3,14,"No","Yes","No","Soccer",,,,,,,,,160,"Per_session","Parks and Rec","N/A","N/A","http://charlestonbattery.com/wp-content/themes/battery/img/battery-logo.png",,,,,,
"JUNIOR CADET CLUB","juniorcadetclub.com","info@juniorcadetclub.com","412-400 Eglinton Ave.","E Toronto","ON","M4P 1M1","416-939-1081","Junior Cadet Club is a not-for profit organization in Toronto, established in 2013. Junior Cadet Club takes a direct approach to finding new ways to keep kids active, healthy, and learning. Creating affordable solutions for youth in communication, nutrition, community, education, and more. Junior Cadet Club focuses on three key programs: Education through hands on projects, Support for all our Cadets and Community, and Growth by allowing our Cadets to learn in an environment where teamwork and creative input is a key part of our program.",8,14,"Yes","Yes","No","After School Care","Fitness","Mindfulness","Play/Outdoor","Nature Programs","Creative Arts","Academics",,,40,"Per_session","Active","https://www.facebook.com/JuniorCadetClub","No","http://static.wixstatic.com/media/b08036_41e23c0852e150f2faab92c332ed74d4.png_srz_p_146_146_75_22_0.50_1.20_0.00_png_srz","https://scontent-a-lga.xx.fbcdn.net/hphotos-xfp1/v/t1.0-9/73951_634322389930531_1936432220_n.jpg?oh=2d2b304586fe0990f0f937151e51bfac&oe=54D56856",,,,,
"Suzie's Farm","http://suziesfarm.com/","abby@suziesfarm.com","2550 Sunset Ave","San Diego","CA",92154,"619-662-1780","Send your autumn sprout to learn the ins and outs of the farm in our favorite time of year: Harvest!
Your campers will be guided through the mystery and magic of this amazing shoulder season. Through games, crafts, field hikes, and cooking lessons, campers will learn about healthy growing and healthy eating. Our K-5 Harvest Camp gives campers the opportunity to engage their hands, hearts, and taste buds as we explore the pick of the season and how to prepare and preserve our bounty for the coming winter. Each day will include time in our fields, time in the kitchen, as well as getting up close and personal with our famous chickens! At the end of our time together, you camper will show off their new skills as we’ll invite you to celebrate the season Suzie’s style with a Family Harvest Festival!",1,12,"No","Yes","No","Farm","Nature Programs","Animals","Academics",,,,,,180,"Per_session","Active","https://www.facebook.com/suziesfarm","Yes","http://suziesfarm.com/wp-content/themes/suzie/logo.png","http://suziesfarm.com/wp-content/uploads/2013/04/DSC_0103-675x450.jpg",,,,,
"ALL-PRO Lineman Camp LLC","allprolinemancamp.com","albersjj@allprolinemancamp.com","S8628 County Highway PF","Plain","WI",53951,"608-206-2182","It is the mission of the ALL-PRO Lineman Camp LLC to improve or enhance the abilities of every participant at their position on either the offensive or defensive line. Extremely successful and proven individual techniques and skill execution along with the mental preparation for proper line play is emphasized. The ALL-PRO Lineman Camp LLC believes in a gradual progression to its teaching and instruction with an importance stressed on team concepts. The success is accomplished through organized, disciplined, and structured instruction from quality experienced coaches. Combining also this quality with a very low number of players per coach ratio!",12,18,"No","Yes","No","Football",,,,,,,,,180,"Per_session","Active","N/A","N/A","http://allprolinemancamp.com/images/linemansmall.jpg",,"Middleton High School",,,,
"Woodford Cedar Run Wildlife Refuge","cedarrun.org","erin.kiefer@cedarrun.org","4 Sawmill Road","Meford","NJ",8055,"856-983-3329","Walk in the woods, dig in the dirt, and wade in the water during our week-long nature camps. Daily activities include hands-on experiences and experiments, visits with native wildlife, and creative play. Sessions available for ages 3-14.",3,14,"No","Yes","No","Adventure/Outdoors","Nature Programs","Hiking","Animals",,,,,,90,"Per_session","Active","https://www.facebook.com/cedarrun","Yes","https://fbcdn-profile-a.akamaihd.net/hprofile-ak-ash2/v/t1.0-1/p160x160/382292_605563012791003_749898941_n.jpg?oh=6f14bc1964a6f245de0204bb49abd27a&oe=55171FBE&__gda__=1424482111_0e6bb8e202885f3f6dcc51efcad86a85","http://www.cedarrun.org/Assets/survival%20shelters.jpg",,,,,
"New Mexico State University Golf Course","http://www.nmsugolf.com/","jaw@nmsu.edu","1600 International Mall","Las Cruces","New Mexico",88003,"575-646-3219","The Academy is designed to accommodate juniors between the ages of 5-18.  Instructional programs, rules seminars, etiquette and playing opportunities are designed around the specific needs of each junior. NMSU Spring Camps are designed for Junior Golfers of all ages and abilities.  Instruction will be based around individual students needs.",5,18,"Yes","Yes","No","Golf",,,,,,,,,60,"Per_session","unclear","https://www.facebook.com/NewMexicoStateUniversityGolfCourse","No","http://d2tbfnbweol72x.cloudfront.net/6463219/files/2014/05/logo.png?fcdn=siVJcLqs","https://scontent-b-lga.xx.fbcdn.net/hphotos-xfp1/v/t1.0-9/10563118_781103991912778_3617955345352888711_n.jpg?oh=b0ab3a45860dc123a7427a2f137623e4&oe=54D65E57",,,,,
"Camp Lawroweld","lawroweld.org","camplawroweld@gmail.com","288 West Side Rd","Weld","ME",4285,"207-797-3760","Beautiful Camp Lawroweld is nestled at the base of several mountains on a 1,000-foot frontage of Lake Webb. We offer summer camps for juniors, teens and families.",8,17,"No","Yes","No","Adventure/Outdoors","Nature Programs","Kayaking","Canoeing","Archery","Water Sports","Swimming","Creative Arts","Sports",300,"Per_session","Active","https://www.facebook.com/Lawroweld","Yes","http://lawroweld.org/wp-content/uploads/2013/03/lawroweld_logo2copy1.png","http://lawroweld.org/wp-content/uploads/2013/03/header1.jpg",,,,,
"Kruz Kidz Summer Day Camps","kruzkidz.com","registrar@kruzkidz.com","2701 Cabrillo College Dr","Aptos","CA",95003,"831-465-3386","Kruz Kidz is dedicated to offering a place where every child can play, grow, refresh, and rest in God’s love. We offer 4 weeks of Discovery Camps with 23 different options to choose from, from sports, cooking, dance, art, science and more. Plus 5 weeks of Adventure Camps for all girls and boys entering 1st grade through 6th grade. And Surf and Computer camps are open for 4-7th graders. We also offer a Junior Counselor camp for campers entering 7th-9th grade.",6,14,"No","Yes","No","Christian","Nature Programs","Sports","Cheerleading","Music","Creative Arts","Science","Cooking
Crafts","Drama/Theater",,,"Active","N/A","N/A","N/A","N/A",,1,9,,"No pricing info on site or Active, no usable pics or FB page"
"Mizzou Tennis Camp","http://www.mutigers.com/camps/","schmids@missouri.edu",,,,,"(573) 884-2041","The Mizzou Tennis Camp is an instruction and competition-based camp, open to all levels, from beginners to nationally-ranked players. Campers will receive individual technique instruction, participate in group drills and compete in team match play.",6,18,"No","Yes","No","Tennis",,,,,,,,,475,"Per_session","Active","https://www.facebook.com/MizzouTennis","Yes","http://grfx.cstv.com/schools/miss/graphics/miss-14-logo.png","https://scontent-b.xx.fbcdn.net/hphotos-xpa1/v/t1.0-9/10298818_788817624509134_1545775950824480775_n.jpg?oh=c185016bc62178e8c4ff9c9eab006850&oe=551A88E1",,,,,
"Science Explorations","http://science-explorations.info.yorku.ca/","explore@yorku.ca","4700 Keele Street","Toronto","ON","M3J 1P3","416-736-2100","The Science Enrichment Office offers innovative and engaging programs designed to inspire youth and discover exciting topics in science, technology, engineering, and mathematics (STEM). Out of the Faculty of Science at York University, our programs use a discovery and inquiry-based learning approach that is focused on ‘learning by doing’. Our outreach model provides students with a chance to work in small groups on a variety of projects that will help foster problem solving, critical thinking, and an overall passion for STEM.",8,13,"No","Yes","No","Academics","Science/Technology","Math","Chemistry",,,,,,275,"Per_session","Active","https://www.facebook.com/pages/York-University/12922531419","Yes","http://science-explorations.info.yorku.ca/files/2013/02/SciX250.jpg","http://science-explorations.info.yorku.ca/files/2013/12/York-Science-2.png","York University",3,8,,
"Northland Bible Camp","www.northlandbiblecamp.com","information @ NorthlandBibleCamp.com","P.O. Box 563,","Kirkland Lake","ON","P2N 3J5","705-567-3490","Northland Bible Camp is situated on beautiful Butler Lake and has been offering Christian camping for over forty-five years! Northland offers a get-away for the entire family in God's wonderful Creation as seen in Northern Ontario. Campers can enjoy this Creation through activities such as canoeing, fishing and hiking. Other waterfront activities include swimming, paddle-boating, tubing and water polo. A volleyball court, large playing field, cement sports pad and playground equipment are also found at Northland.",7,18,"No","Yes","No","Christian","Adventure/Outdoors","Swimming","Water Polo","Play/Outdoor","Sports",,,,,,"Active","https://www.facebook.com/pages/NorthLand-Bible-Camp/143232755736717","No","http://www.northlandbiblecamp.com/images/Titlebar/titlebar_logo.jpg","https://fbcdn-sphotos-c-a.akamaihd.net/hphotos-ak-xpf1/v/t1.0-9/p417x417/997090_803149813078338_1373860100438284670_n.jpg?oh=529536043dacf5bd7e7bf80ab3e997dd&oe=551B4EDB&__gda__=1423660163_b1d2b8819399831d66716c0d468684ab",,,,,"No pricing info on site or Active"
"Weathervane Playhouse","weathervaneplayhouse.com","mycp@weathervaneplayhouse.com","1301 Weathervane Lane","Akron","OH",44313,"330-836-2626","Welcome to another exciting season here at Weathervane!  At Weathervane, we teach the art that we love. As a reflection of life, Theatre encompasses every aspect of living. It allows each of us to walk the road in someone else’s shoes and shows us our own potential for failure and success. Because of this, Theatre is an extraordinary tool for understanding, growth and change. Our passion is to share this art with you and allow it to enlighten, challenge and change us all. Nearly 22,000 educators, students and their families participate in Weathervane theatre classes, performances, workshops and Youth Theater experiences each year!",3,14,"Yes","No","No","Performing Arts","Drama/Theater","Dance",,,,,,,105,"Per_session","Active","https://www.facebook.com/pages/Weathervane-Playhouse/209196262487829","Yes","https://fbcdn-profile-a.akamaihd.net/hprofile-ak-xpa1/v/t1.0-1/c16.0.149.149/1798517_602584826482302_349936694_n.jpg?oh=43b64f03ab032a9ea242dd5177dc23df&oe=551EEF8B&__gda__=1423365468_715ab9472f026193901c353d5180f090","https://scontent-a.xx.fbcdn.net/hphotos-xaf1/v/t1.0-9/1012357_491313584276094_1467521568_n.jpg?oh=46d5dce935183773ae482fa2fbaca5df&oe=54D72888",,,,,
"HoLa Programs","http://holahoboken.org/","info@holahoboken.org","123 Jefferson Street","Hoboken","NJ",7030,"201-427-1458","Not your regular summer camp, HoLa’s Aventuras Veraniegas is a Spanish Immersion Camp designed for students entering Kindergarten through 6th grade.  While our Aventuras Veraniegas is designed to complement the HoLa curriculum it is open and appropriate for any student interested in acquiring or strengthening their Spanish language and creative writing skills.",5,12,"Yes","Yes","No","Academics","Swimming","Dance","South America","Creative Writing","Creative Arts","Math",,,400,"Per_week","Active","https://www.facebook.com/HoLaHoboken.org","No","http://p1cdn4static.sharpschool.com/UserFiles/Servers/Server_20288871/Templates/hobo-logo.png","https://fbcdn-sphotos-f-a.akamaihd.net/hphotos-ak-xfa1/v/t1.0-9/480224_361954500519504_982716361_n.jpg?oh=2293dc2933d603d1eb4578ddf16d98ab&oe=54E30F42&__gda__=1424030204_63dee158c5a06a88ccacf47a94f761a1",,,,,
"Top Flight Elite Baseball","topflightsportsacademy.com","nate@topflightsportsacademy.com","P.O. Box 1467","Campbell","CA",95009,"408-499-8161","Top Flight Sports combines years of experience, cutting edge training techniques and elite instruction to all athletes who are looking to improve on their skills and take their game to the next level. We provide a wide range of athletic training including basketball, baseball, football, soccer, strength, speed & agility. Lessons and training can be done in an individual, group or team setting. We specialize in working with youth ages 7-18. We have also trained elite college athletes, professional athletes and even the weekend warrior that is trying to get an edge in their recreational activity. No matter what age or skill level you may be, there is always room for improvement and Top Flight Sports is here to help.",7,18,"Yes","Yes","No","Baseball","Basketball","Football","Soccer",,,,,,225,"Per_session","Active","https://www.facebook.com/topflightsports?ref=ts","Yes","http://topflightsportsacademy.com/images/TFS_Logo_MAIN_SML_RGB.jpg","https://scontent-b.xx.fbcdn.net/hphotos-xfp1/v/t1.0-9/10569029_824460350921340_7272937839632706101_n.jpg?oh=3de09e965c495222de95ca03b0353958&oe=54D9A259",,,,,
"Main Beach Surf and Sport","http://www.mainbeachcamps.com/","sales@mainbeach.com","352 Montauk Highway","Wainscott","NY",11975,"631-537-2716","Main Beach Surf and Sport offers the Best Hamptons Surf Lessons. At Main Beach you’ll find the most experienced teachers, local knowledge, a focus on safety and skills and an all around great surf program. We’ve been giving surf lessons on the East End of Long Island for over 20 years. We also offer amazing surf camps as well.",5,18,"Yes","Yes","No","Surfing","Kayaking",,,,,,,,150,"Per_class","Active","https://www.facebook.com/MBXCamp?ref=hl","No","http://cdn.shopify.com/s/files/1/0332/7021/t/5/assets/logo.png?1936","http://static.squarespace.com/static/530082f7e4b085ddb65406c4/5304e12de4b0c1e749b42b82/5304e200e4b01951dab706d8/1392828934184/IMG_4114.jpeg?format=1000w",,,,,
"Blazer Volleyball Camps","http://volleyball.blazersportscamps.com/","jgreenvb@uab.edu","1720 2nd Ave South","Birmingham","AL",35294,"205-394-1304","Blazer Volleyball Camps provide instruction on skill development, competition, functional and strength training, goal development and leadership activities for grades 3 - 8. All sessions take place at the CSB Haehn Campus Center. Indoor athletic facilities are air-conditioned.",8,14,"No","Yes","No","Volleyball","Leadership",,,,,,,,50,"Per_session","MyOnlineCamp","https://www.facebook.com/pages/College-of-Saint-Benedict-Blazer-Volleyball-Summer-Camps/216804831672750?sk=info&tab=overview","No","http://volleyball.blazersportscamps.com/images/Banner_5_copy.jpg","http://volleyball.blazersportscamps.com/images/img_4944.jpg","College of St Benedict",3,8,,
"Helen Hayes Youth Theater","http://www.helenhayesyouththeatre.com/","helenhayesyt@aol.com","142 Main Street","Nyack","NY",10960,"845-826-2049","The Helen Hayes Youth Theatre offers year-round theater classes and performance opportunities for young actors ages 5 to 18 from all backgrounds of theater experience. Our programs take place in our homebase of Nyack, as well as Westchester County, New York. Our mission is to provide rigorous training in the theater arts while also offering training in life skills such as public speaking, improved focus, social skills, self-confidence and team building under the watchful eye of our staff of highly committed theater professionals.",5,18,"Yes","Yes","No","Performing Arts","Drama/Theater",,,,,,,,350,"Per_session","Active","https://www.facebook.com/HelenHayesYouthTheatre","No","https://fbcdn-sphotos-a-a.akamaihd.net/hphotos-ak-xaf1/v/t1.0-9/430216_272174456191583_1670421043_n.jpg?oh=543204978c9e3639f49fdc25f03ee783&oe=5511A950&__gda__=1427679361_e1cd2670b970334694b636bf8bfcce5d","https://scontent-a.xx.fbcdn.net/hphotos-xap1/v/t1.0-9/1098525_498305526911807_1088040218_n.jpg?oh=928de90e9856659349fc9982b35e018d&oe=54D984A7",,,,,
"Stanford Basketball","http://www.stanfordboysbasketball.com/","boyshoopcamp@stanford.edu","450 Serra Mall","Stanford","CA",94305,"650-725-7715","Stanford University offers basketball camps for boys grades 1 thru 12. We offer day camps, overnight camps and development camps.",6,18,"No","Yes","No","Basketball",,,,,,,,,400,"Per_session","Active","N/A","N/A","http://image.cdnllnwnl.xosnetwork.com/fls/30600/site_graphics/2013/logo.png",,,1,12,,"No usable pics on site"
"Mark Wood Rock Orchestra Camp","markwoodmusic.com","mwroc@markwoodmusic.com",,"Olathe","KS",,"516-767-6677","Mark Wood Rock Orchestra Camp is a week-long music education experience where attendees are immersed in cultivating self-expression through improvisation, performance, and the latest technology; and where they get to put all their new tools to use in a grand finale international rock orchestra concert event – open to the public – on the camp’s last night.We’ve helped hundreds of musicians, young and old, to discover their own voice – not only as players but as PEOPLE. We believe that the art of building confidence in your own unique powers of self-expression is KEY to making your way in the world. Come to MWROC and celebrate the greatness of YOU!",12,99,"Yes","Yes","No","Music","Bass Guitar","String","Voice",,,,,,1000,"Per_session","Active","https://www.facebook.com/mwroc","Yes","http://www.mwroc.com/wp-content/uploads/2013/09/MWROC2013logo.png","https://fbcdn-sphotos-c-a.akamaihd.net/hphotos-ak-xap1/v/t1.0-9/10477069_694617810587535_2340271724907554801_n.jpg?oh=cc3456f2439a141b6b990a3d600489bc&oe=54E43B56&__gda__=1423222410_a120025cf1ee27f9b65e20773f717a4b","MidAmerica Nazarene University",,,,
"Common Threads","commonthreads.org","amartin@commonthreads.org","500 N. Dearborn, Suite 605","Chicago","IL",60654,"312-329-2501","Through our cooking and nutrition programs and curriculum, we help prevent childhood obesity and reverse the trend of generations of non-cookers, while celebrating our cultural differences and the things people all over the world have in common. We offer many programs, including camp. This camp is a three-week camp focused on cooking, physical fitness, and food-science education. The students spend five days a week during the summer months cooking, exercising, and participating in a food-science lab.",5,99,"Yes","Yes","No","Cooking
Crafts","Academics",,,,,,,,,,"Active","https://www.facebook.com/CThreads?ref=ts","Yes","https://fbcdn-profile-a.akamaihd.net/hprofile-ak-xap1/v/t1.0-1/p160x160/10687033_975887389107594_7687128953202477427_n.jpg?oh=a8f74ba3fe93f270962b1f8bda42bf75&oe=54DD1B92&__gda__=1423359895_9c624ad5d2598180182c3480edb405a9","https://fbcdn-sphotos-c-a.akamaihd.net/hphotos-ak-xaf1/v/t1.0-9/10306393_996183960411270_2753983818805362077_n.jpg?oh=a869568fb173f84c65acb4241b560aac&oe=54DE775C&__gda__=1424574957_35d421a2a4368e2dff4f020afe4e990e",,,,,"No pricing info on site or Active"
"Pettijohn Springs Christian Camp","pettijohnsprings.com","manager@pettijohnsprings.com","14756 Pettijohn Springs Camp Rd.","Madill","OK",73446,"580-795-5015","In the rocky hills of southern Oklahoma, just 15 minutes from Lake Texoma, there is a wilderness opened for adventure and personal growth—Pettijohn Springs Christian Camp (PSCC). PSCC provides an environment immensely suitable for spiritual growth and for building and strengthening relationships. PSCC has a great history, an amazing tradition, and a respected reputation.",8,18,"No","Yes","No","Christian","Adventure/Outdoors",,,,,,,,150,"Per_session","Active","https://www.facebook.com/pages/Pettijohn-Springs-Christian-Camp/206706389373231","N/A","http://www.pettijohnsprings.com/wp-content/uploads/2013/11/pjs-logo-106x70.png",,,,,,"No usable pics on site or fb"
"Geering Up","http://www.geeringup.apsc.ubc.ca/","geeringup@apsc.ubc.ca","5000-2332 Main Mall","Vancouver","BC","V6T 1Z4","604-822-2858","Geering Up UBC Engineering & Science for Kids is a non-profit organization with the mandate of promoting science, engineering and technology to youth across British Columbia. Affiliated with the University of British Columbia, Geering Up is designed, organized and operated by UBC students. We endeavour to show program participants how fun, exciting and useful engineering and science can be. Geering Up camps are all about making Science Technology and Engineering hands on and exciting. Each day is a dynamic mix of hands on activities, demonstrations, tours, mentors, and design challenges. Our camps are taught by experienced university students with a passion for their field of study. In addition to all of this we ensure each camper spends at least one hour of each day participating in active games outside.",8,16,"Yes","Yes","No","Academics","Science","Science/Technology","Industrial Arts",,,,,,190,"Per_session","Active","https://www.facebook.com/GEERingUp","No","https://fbcdn-profile-a.akamaihd.net/hprofile-ak-xpf1/v/t1.0-1/c0.0.160.160/p160x160/10408570_715271191883870_3296226931314785815_n.png?oh=5a2d7affc5d0b61aaf80240a509feae1&oe=551FAEE0&__gda__=1423525170_fb62af0db52a15dddb4c09552e26d4d7","http://www.geeringup.apsc.ubc.ca/wp-content/blogs.dir/1712/files/2013/08/P7300743.jpg?b=1712&w=465&h=460&zc=1","Faculty of Applied Science Vancouver Campus",4,10,,
"Lake Minnetonka Sailing School","lmss.us","director.lmss@gmail.com","19500 Park Ave","Wayzata","MN",55391,"952-404-1645","The LMSS Learn-to-Race programs are designed to be the perfect bridge for sailors who have graduated from a session of Camp Sailing or with previous experience, who are wanting to improve their skills in a moderately competitive environment.  These half-day classes maximize time on the water with a focus on rigging, sailing correctly on all points of sail, the basics of sailing, and understanding the importance of working within a team atmosphere.",8,17,"Yes","Yes","No","Sailing",,,,,,,,,295,"Per_session","Active","https://www.facebook.com/lakeminnetonkasailingschool","Yes","https://fbcdn-profile-a.akamaihd.net/hprofile-ak-xfa1/v/t1.0-1/p160x160/10421967_10152113172831493_5078973430785518996_n.jpg?oh=4ff62275087f8f1259aec15c5da7d28a&oe=54E5044A&__gda__=1423145594_55f0a70eb834c2d003f6bd72c5a13af8","http://lmss.us/wp-content/uploads/2011/02/420LearntoRace_Header.jpg",,,,,
"LCYC Jr Sailing","http://lcyc.info/","jrsailing.lcyc@gmail.com",,"Shelburne","VT",,"802-777-1956","The Lake Champlain Yacht Club is a member-run yacht club located in a sheltered cove on the southwest shore of Shelburne Bay in Shelburne, Vermont. We offer moorings, activities, and community for our members, most of whom own a sailboat or powerboat. The object of the Club is to promote and encourage boating and sailing on Lake Champlain, while emphasizing racing, cruising, and education, without financial gain.",8,17,"Yes","Yes","No","Sailing",,,,,,,,,110,"Per_session","Active","https://www.facebook.com/lcyc.info","No","https://fbcdn-profile-a.akamaihd.net/hprofile-ak-xfa1/v/t1.0-1/c12.12.155.155/935056_490291081040806_1484244447_n.png?oh=9f7ae8aba5421fe8493553892ab9a9e4&oe=55182698&__gda__=1423172906_62ddd72c31fe1dbde0512196d2025411","https://scontent-b.xx.fbcdn.net/hphotos-xfa1/v/t1.0-9/164430_530447710358476_1549612570_n.jpg?oh=8efc0ff9cc3ac7611179947fc8ff8d70&oe=55100498",,2,12,,
