"provider_name","website","email","street_address","city","state","Zipcode","Metro Area","Sales agent","phone","description","from_age","to_age","has_class","has_camp","has_birthday_party","activity type (select from the menu)","activity type (select from the menu)","activity type (select from the menu)","activity type (select from the menu)","activity type (select from the menu)","activity type (select from the menu)","activity type (select from the menu)","activity type (select from the menu)","Activity Type (not in the drop down list/choose from the list here: http://www.activityhero.com/in/san-jose-ca/categories)","Starting price","price_type (values - ""per_class"", ""per_session"" , ""per_month"", ""per_hour"", ""per_day"", ""per_week"", ""per_year"", ""per_season"")","Registration Type  (online, web form, pdf)","Facebook page","Over 500 likes (y/n)","logo_url","photo_url","location_name","from_grade","to_grade","Notes","HOT LEAD"
"Playball","http://deedee.usaplayball.com/","Playballkids1@gmail.com",,,,,"NorCal","Hailey","415-484-5916","Playball is a sports and movement program for children age 2-6. We offer a multi-skill program which focuses on the basic fundamental sports skills of 6 different sports including soccer, tennis, baseball, basketball, hockey, and volleyball. Our creative and highly engaging curriculum ensures that the children have a positive experience with us and enjoy every minute of being physically active!",2,6,"Yes","Yes","Yes","Soccer",,,,,,,,,,"None listed","Phone or email","https://www.facebook.com/PlayballSanFrancisco","N/A",,"https://www.kidinmecoaching.com/system/website/side_images/123/thumb/14.jpg",,,,,
"Belmont United Soccer Club","http://www.eteamz.com/BelmontUnited/","belmont.united@gmail.com","PO Box 403","Belmont","CA",94002,"NorCal/Peninsula","Hailey",,"Our soccer academy is open to all children looking to develop their skills and to prepare for competitive soccer the program is led by our Director of Coaching - Jose Cedeno - supported by professional coaches from the club. Through the Academy program Children develop a wide range of fundamental soccer skills including dribbling, passing and shooting. earning is achieved through fun, exciting and motivating games and exercises, all participants will gain confidence, a positive self-esteem, increased motor skills and increased ball familiarity.",5,18,"Yes","Yes","No","Soccer",,,,,,,,,115,"Per_session","Active","https://www.facebook.com/groups/166205183542928/","N/A","http://www.eteamz.com/BelmontUnited/images/L_BUSCNewLogo_3_4912791.jpg","http://photos-images.active.com/file/1/4912791/optimized/98390ac8-1f6c-4b5e-952e-834acb165b28.jpg",,,,,
"Piedmont Soccer Academy","http://www.piedmontsoccer.org/","admin@piedmontsoccer.org","P.O. Box 20801","Piedmont","CA",94620,"NorCal/EastBay","Hailey",,"The Piedmont Soccer Club offers the PSC Youth Academy during the fall season for U8-U10 players and for parents and coaches of all age groups. The Academy is a series of clinics intended to help develop exciting, skillful players and to help develop more effective parent coaches. This will be done through an active learning environment where passion for the game and fun are the emphasis. The Academy is a recreational program that provides soccer skills training for 6, 7, 8 and 9 year olds and coaching education for interested parents that emphasizes fun for all participants.",6,9,"Yes","No","No","Soccer",,,,,,,,,550,"Per_season","Sportability","https://www.facebook.com/groups/204284352959598/","N/A","http://piedmontsoccer.org/images/banner6/images/banner1.jpg","http://piedmontsoccer.org/fpss/slideshows/news/images/DePetra%20U10G%20Team%20Tiburon%202014%20540x380.jpg",,,,,
"Heritage Soccer Club","http://www.heritagesc.com/","jim@heritagesc.com","22 Old Rodgers Ranch Ct","Pleasant Hill","CA",94523,"NorCal/EastBay","Hailey","925-942-0759","Heritage's Year Round Academy is open to boys and girls ages 4 to 9yrs old. The Academy focuses on basic soccer skills under the supervision of our adept instructors with many years of club and high school experience.  Our Professional Staff will direct the natural talent of the children and guide them in a very progressive and detailed way.  Our goal is to teach them correct soccer fundamentals, how to make proper Soccer moves, and to form a team ideology.  Most importantly, its lots of fun!",4,9,"Yes","Yes","No","Soccer",,,,,,,,,195,"Per_session","GotSport","https://www.facebook.com/pages/Heritage-Soccer-Club/190530947630346","Yes","http://static.wixstatic.com/media/15ef6a_a3d061ac3c4933d9e9ad3e4674a44041.png_srz_p_983_162_75_22_0.50_1.20_0.00_png_srz","http://static.wixstatic.com/media/15ef6a_e1f0ea32d76f0121dec455ac04bd5219.jpg_srz_p_400_235_75_22_0.50_1.20_0.00_jpg_srz",,,,,
"Capital Athletic Soccer Academy","http://www.capitalathletic.com/","casaclub@sbcglobal.net","4345 American River DriveSuite A","Sacramento","CA",95864,"NorCal","Hailey","916-489-2272","BOCA is a competitive soccer club for boys and girls in the Sacramento area. Our club is dedicated to teaching the skills and tactics of the game with the idea of developing a constructive style of play based on fluid possession and team orientation. We believe that the athletic development of our youth must contribute to the development of good character and citizenship.",5,18,"Yes","Yes","No","Soccer",,,,,,,,,150,"Per_session","GotSport","https://www.facebook.com/bocafcsoccer","Yes","http://www.bocasoccer.org/wp-content/uploads/2014/03/BOCA-LOGO.png","http://www.bocasoccer.org/wp-content/uploads/2014/01/Boca-Juniors-Program.jpg",,,,,
"Soccer2gether","http://www.soccer2gether.com/","nitzanyerovam@gmail.com","739 Woodhaven Rd","Berkely","CA",94708,"NorCal/EastBay","Hailey","(510) 847-6077","Soccer2gether has a vision to bring people together and create community through the great game of soccer. We are eager to develop soccer skills as well as life skills through exercises and games that engage our players in a variety of physical activities. Our program is focused on instilling basic motor skills, soccer fundamentals, self-confidence, and the virtues of teamwork and cooperation in a relaxed, unhurried and personal environment.",3,11,"Yes","No","No","Soccer",,,,,,,,,85,"Per_season","Paypal","https://www.facebook.com/groups/190684220963162/","N/A","http://static.wixstatic.com/media/60b652_be0f5137175c478a8f91cccda0f6a497.png_srz_p_220_165_75_22_0.50_1.20_0.00_png_srz","http://static.wixstatic.com/media/60b652_f26cc3ee69ac425f85e3f286e2f59484.jpg_srz_p_349_311_75_22_0.50_1.20_0.00_jpg_srz",,,,,"Yes"
"SFF Soccer Cubs","http://sffsoccercubs.com/","info@sffsoccercubs.com","261 Loomis St.","San Francisco","CA",94124,"NorCal/SF","Hailey","415.747.0802","SFF Soccer Cubs is a fun-filled development program built to get your little ones out on the field for some quality playtime. Using a variety of activities, we help kids build confidence, improve coordination skills and learn soccer basics in a fun and safe environment. We’ve got classes for all ages from 18 months to 5 years – join the team!",1.5,5,"Yes","No","Yes","Soccer",,,,,,,,,180,"Per_session","cart on website","https://www.facebook.com/pages/SFF-Soccer-Cubs/416276011809390","No",,"http://sffsoccercubs.com/wp-content/uploads/2013/12/0007_bday_fpo.jpg",,,,,"Yes"
"Grasshopper Soccer","http://www.grasshoppersoccer.com/",,"3032 Fulton Ave","San Francisco","CA",94118,"NorCal/SF","Hailey","(415) 308-0603","We aim not only to improve your child's soccer skills but to provide a fun, non-competitive environment for our young grasshoppers to grow into confident and successful soccer stars of the next generation.  Through our techniques even the most shy and extroverted kids are able to excel at their own speed towards total skills development. ach clinic is designed to build upon the last to provide a comprehensive training experience in an enjoyable and supportive atmosphere. Grasshopper Soccer has a stellar reputation for our high instructor-to-student ratio to ensure each child receives the attention they deserve.",3,9,"Yes","No","No","Soccer",,,,,,,,,160,"Per_session","cart on website","https://www.facebook.com/pages/Grasshopper-Soccer-USA/373530159347604","No","http://www.grasshoppersoccer.com/sites/all/themes/grasshopper/logo.gif","http://www.grasshoppersoccer.com/files/imagecache/gallery_sidebar/n655231819_963265_5319.jpg","San Francisco, Napa, and Marin locations",,,,"Yes"
"Off the Wall Extreme Soccer","http://www.offthewallextreme.com/","soccer@offthewallextreme.com","5 Wayne Court","Sacremento","CA",95829,"NorCal/Sacramento","Hailey","916-383-4200","Off The Wall in partnership with the Extreme Sports Academy is proud to present a variety of training sessions for area soccer and rugby players. We are excited to introduce a new age specific program for U5-U6 boys and girls.",5,7,"Yes","No","No","Soccer",,,,,,,,,175,"Per_session","PDF","https://www.facebook.com/pages/Off-The-Wall-Indoor-Soccer/111746955523088","Yes","http://www.offthewallextreme.com/templates/OTW%20Home/images/logo_header.png",,,,,,"Yes"
"Goalgetters Indoor Soccer","http://www.goalgettersindoorsoccer.com/","davisindoor@gmail.com","1809 Picasso Ave","Davis","CA",95618,"NorCal/Sacramento","Hailey","530-756-3200","Goalgetters Indoor Soccer takes place on a state-of-the-art indoor soccer field inside the Davis Athletic Club. The indoor facility allows everyone to play the world’s favorite game in comfort all year long. Our youth program starts kids young with a focus on having fun and learning life lessons such as respect, sharing, sportsmanship, teamwork and responsibility (all of which soccer caters to perfectly with its focus on teamwork, patience and fun for all). Meanwhile these little guys are getting the early skills to master the game later on. The older kids also have a ton of fun while benefiting from instruction based on European and Brazilian small-sided soccer. The indoor facility affords kids a high percentage of ball contact within a confined area. Also, for players who learn to play soccer indoors (with the emphasis on quick and accurate ball skills as well as on field vision and awareness), outdoor play becomes significantly easier.",2,9,"Yes","No","Yes","Soccer",,,,,,,,,139,"Per_session","Phone or email","https://www.facebook.com/goalgettersdavis","No",,"http://www.goalgettersindoorsoccer.com/images/chute.jpg","Davis Athletic Club",,,,"Yes"
"Galaxy Blues Academy","http://www.galaxybluesfc.com/","info@galaxybluesfc.com","701 Wildcat Blvd","Rocklin","CA",95765,"NorCal/Sacramento","Hailey",,"Blues Player Development Clinics are geared towards the soccer player looking to increment their normal team training to build their skills and understanding of the game. These sessions are designed for players at all levels and also provide an excellent introduction into the Blues Training Philosophy. The U7/U8 Academy Program is the entry program into the Galaxy Blues competitive soccer team play and training. The program establishes necessary technical skills and confidence, while creating a thirst for personal challenges and individual improvement. Our program maximizes the players touches on the ball in a safe and friendly environment to encourage our young athletes to take risks and experiment. The technical skills and ability to function within small group concepts established in this program positions the young athlete to compete in the more competitive programs that follow.",6,12,"Yes","Yes","No","Soccer",,,,,,,,,100,"Per_month","Paypal","https://www.facebook.com/galaxybluesfc","Yes","http://calbluessoccer.epaiges.com/wp-content/themes/GalaxyBlues//img/galaxy-blues-logo.png","http://calbluessoccer.epaiges.com/wp-content/uploads/2014/01/u8-pic.jpg","Multiple",,,"Player developement programs and player academy","Yes"
"Pacific Elite Soccer Academy","http://www.pacificelitesocceracademy.com/","mcoleman@pacific.edu","3601 Pacific Avenue","Stockton","CA",95211,"NorCal/EastBay","Hailey","209-946-7301","The purpose of our Skills Academy is to give youth soccer players opportunities outside their regular team practices to work on skill development and to help them understand the concepts of soccer and how it applies on the field. Sessions will be run by the Pacific Soccer collegiate coaching staff and players. Our training sessions run year round.",8,18,"Yes","Yes","No","Soccer",,,,,,,,,60,"Per_session","Campnetwork","https://www.facebook.com/PacificSoccer","Yes",,"http://www.pacificelitesocceracademy.com/wp-content/uploads/2014/06/RS46881_Soccer-Summer-Sports-Camp-2014-26-176x116_c.jpg",,,,,
"San Francisco Vikings Soccer Club","http://www.sfvsc.org/","sfvikingssoccer@sbcglobal.net","12101 Van Nuys Blvd. #16","Lake View Terrace","CA",91342,"SoCal","Jeana","415-753-3111","The Academy is designed for boys and girls who love soccer and are looking for developmental opportunities in addition to their practices with their fall team. The Academy is looking for players who are committed to developing their soccer skills and are mentally and emotionally ready to benefit from a structured technical training environment.",8,11,"Yes","Yes","No","Soccer",,,,,,,,,100,"Per_session","Formsite.com","https://www.facebook.com/pages/San-Francisco-Vikings-Soccer-Club/373233062790797","NO",,"http://cdn4.sportngin.com/attachments/text_block/3598/8375/soccer__3__large.jpg",,,,,
"Cal South","http://www.calsouth.com/",,"1029 S. Placentia Avenue","Fullerton","CA",92831,"SoCal","Jeana","888.429.7276","Cal South provides sanctioning as a CCAP Program in order to allow soccer instructors and youth players to participate in skills-based development programs with the resources and support of Cal South. CCAP Programs focus mainly on introductory soccer activities and/or technical skill development in an individual or small group setting. Advanced CCAP Programs may also offer specialty skill development training programs (goalkeeping, finishing, etc.). CCAP Programs predominately target U4 to U10 players, but may be offered up to the U19 age group. Participants are not provided a Cal South Player Pass, nor are they eligible for league play or tournaments unless appropriately registered and rostered to an eligible team.",4,10,"Yes","Yes","No","Soccer",,,,,,,,,200,"Per_session","Formsite.com","https://www.facebook.com/CalSouthSoccer","Yes",,,,,,,
"Brea Soccer Association","http://www.breasoccer.org/","soccer@breasoccer.org","PO Box 573","Brea","CA",92822,"SoCal","Jeana","714-256-1382","The Brea Soccer Association (known on the field as AC Brea - referring to all levels of play, recreational, club, camps, clinics, futsal, adults, etc.) has a long history of service in and around the community of Brea. We are proud of our past and look forward to meeting the needs of our community. Today, AC Brea is a full-service youth and adult soccer organization.",5,18,"Yes","Yes","No","Soccer",,,,,,,,,,"None listed","Demosphere","https://www.facebook.com/acbrea","No","http://www.breasoccer.org/images/2013/home-1-1.png","http://www.breasoccer.org/imgs/036.jpg",,,,,
"Little Rascals Soccer Club","http://littlerascalzsoccer.com/",,"830 Valley Center Drive, Suite 705 - 826","San Diego","CA",92130,"SoCal","Jeana","619-309-9626","At Little Rascalz our soccer classes for kids are unique and not like any other sports programs. hey are purposely designed to be fun, silly, age appropriate and a high energy experience for your toddler.  Our Soccer & Mommy 'n' Me sports programs feature exciting games and activities to teach the rudimentary skills of the sport, and all that comes with it. Your toddler will learn to participate in a group, follow simple instructions, cooperate with peers, develop gross motor skills, and lets not forget the obvious benefits of having them burn off some of that energy...eh! 
Little Rascalz Soccer coaches are, as you have come to know, highly experienced in dealing with toddlers and young children and are brilliant at what they do!  Located throughout San Diego, you can find us having fun at a community park in your neighborhood.",1.5,7,"Yes","Yes","Yes","Soccer",,,,,,,,,146,"Per_session","MyIMatrix","https://www.facebook.com/pages/Little-Rascalz-Soccer-School/113198062036860","Yes","http://my.imatrixbase.com/clients/585/images/slideshows/10150/lrsbanner1.jpg",,,,,,
"Strikers South Coast Junior Academy","http://southcoaststrikers.com/","bobby@scbayeern.com","18141 Beach BlvdSuite 395","Huntington Beach","CA",92648,"SoCal","Jeana","714-658-2221","STRIKERS FC - SOUTH COAST is dedicated to provide a soccer program to regional youth that inspire enjoyment of the game, development of soccer skills and discipline of integrity. We offer a structured program that emphasizes discipline and sportsmanship. Family involvement is encouraged to help create a unified soccer community and support for the youth players. As players progress in skill and game understanding, expectations for team play can vary from player to player. STRIKERS FC - SOUTH COAST is dedicated to offering an empowering experience for all participants, with a focus on individual skill and awareness. STRIKERS FC - SOUTH COAST is also dedicated to develop players to their utmost potential.",6,8,"Yes","Yes","No","Soccer",,,,,,,,,10,"Per_class","Phone or email","https://www.facebook.com/strikers.fc.71?fref=ts","N/A","http://southcoaststrikers.com/images/spacer.gif","http://208.166.54.35/~scoast/UserFiles/images/mattie.jpg","HB Sports Complex",,,,"Yes"
"FC Valencia","http://fcvalencia.com/","info@fcvalencia.com","27943 Smyth DriveSuite 210","Valencia","CA",91355,"SoCal","Jeana","661-800-4255","FC Valencia is offering a variety of clinics, training camps, and recreation league activities geared towards player enrichment and overall development.  Creative Soccer Enterprises, Inc. promotes a vision of developmental soccer that advocates a unique focus of training and understanding of youth soccer. The principle objectives of Creative Soccer Enterprises, Inc. are to build programs that promote longer range, developmental and educational programs for youth soccer and beyond, but specifically based on the guidelines for learning that are endorsed by the United States Youth Soccer Association and the United States Soccer Federation.",5,12,"Yes","Yes","No","Soccer",,,,,,,,,160,"Per_session","DirectPay","https://www.facebook.com/futbolclubvalencia","No","https://fcvalencia.com/cms/wp-content/uploads/2014/10/FCV-Hori_1045w292h-Ribbon2.png",,,,,,
"Chula Vsita Rangers Soccer Club","http://www.chulavistarangers.com/","board@chulavistarangers.com","374 E. H St. Ste. A PMB 441","Chula Vista","CA",91910,"SoCal","Jeana","619-454-4116","Our program provides the training and game exposure needed to build confidence in a fun filled instructional environment for boys and girls ages 4 to 10 years old. Players will learn: Ball Mastery, Coordination and most-of-all; HAVE FUN in a Positive Learning Environment. Some advantages to the program include small sided games for mastery, everyone plays, and most of all cultivates affection for the game of SOCCER.",4,10,"Yes","Yes","No","Soccer",,,,,,,,,150,"Per_session","Demosphere","https://www.facebook.com/pages/Chula-Vista-Rangers-Soccer-Club/345077770453","Yes","http://www.rangerssc.net/images/2013/home-1-1.png",,"Voyager Park",,,,
"Crescenta Valley Soccer Club-First Kickers","http://www.cvsoccerclub.com/","reggiesoccer@yahoo.com","12101 Van Nuys Blvd. #16","Lake View Terrace","CA",91342,"SoCal","Jeana","818-257-4515","Crescenta Valley Soccer Club’s First Kickers has teamed up with RightStart Soccer and founder Joel Govea to offer a special program designed just for young players. Our goal is to develop athletes with the skills and tools they need to be successful both on and off the soccer field. The program is age-appropriate and developmentally focused to encourage learning through technical demonstration and movement in a positive and fun learning environment. The purpose of the program is to develop players technically while building confidence and motivation, regardless of ability level.",5,8,"Yes","Yes","No","Soccer",,,,,,,,,125,"Per_session","Demosphere","https://www.facebook.com/pages/Crescenta-Valley-Soccer-Club/234683929530","No","http://www.cvsoccerclub.com/images/2011/header.png","http://www.cvsoccerclub.com/imgs/JuniorAcademy/Kickers_1_3.JPG",,,,,
"NHBFC","http://www.nhbfutbol.com/","info@nhbfutbol.com","PMB 15818685 Main St. #A","Huntington Beach","CA","92648-1719","SoCal","Jeana","714-969-7674","The NHB Academy is designed to help players improve their technical skills and game tactics with an emphasis on ball control and technique. Sessions will be led by NHB licensed coaches under the direction of Academy Director, David Thomas and Director of Coaching and UCI coach Chris Volk. Players will receive small group training followed by small sided games, allowing players to practice and develop new skills.",5,12,"Yes","Yes","No","Soccer",,,,,,,,,90,"Per_session","PDF","https://www.facebook.com/pages/NHB-Futbol-Club/226522900727888","No",,"http://cdn3.sportngin.com/attachments/photo/3038/7195/Goal_kick_small.jpg","Hope View Elementary School",,,,"Yes"
"Nomads Soccer Club & Academy","http://www.nomadssoccer.org/","info@nomadssoccer.org","3908 Torrey Pines Road","La Jolla","CA",92037,"SoCal","Jeana","858-587-0511","Following a comprehensive review of elite player development in the United States and around the world, U.S. Soccer created the Development Academy in 2007 to improve the everyday environment for the elite youth player. he Development Academy is a partnership between U.S. Soccer and the top youth clubs around the country to provide the best youth players in the U.S. with an every day environment designed to produce the next generation of National Team players. The Academy’s programming philosophy is based on increased training, less total games and more competitive games.",11,18,"Yes","Yes","No","Soccer",,,,,,,,,,"None listed","Demosphere","https://www.facebook.com/NomadSoccer","No","http://www.nomadssoccer.org/images/2009/home-1-2.gif","http://www.nomadssoccer.org/imgs/Screen%20Shot%202013-11-07%20at%2010_45_32%20AM.png",,,,,
"Irvine Soccer Academy","http://www.irvinesocceracademy.com/","info@irvinesocceracademy.com","PO Box 60184","Irvine","CA",92602,"SoCal","Jeana","949 466-3129","LEARN SOCCER SKILLS & PLAY TEAM GAMES IN A FUN ENVIRONMENT - Our ""JUNIOR ACADEMY PROGRAM"" is LEARN SOCCER SKILLS & PLAY TEAM GAMES IN A FUN ENVIRONMENT - Our ""JUNIOR ACADEMY PROGRAM"" designed to develop players advanced technical skills. Each player is encouraged to have fun and develop a passion and loyalty to the beautiful game of soccer, while taking their technical game to the next level and developing tactical awareness. Our professional training staff will provide a fun and enjoyable experience while they focus on developing advanced technique in BALL CONTROL, DRIBBLING, PASSING, SHOOTING, TACKLING, TACTICS and PLAYING GAMES.",3,12,"Yes","Yes","No","Soccer",,,,,,,,,49,"Per_session","Korrio","https://www.facebook.com/pages/Irvine-Soccer-Academy/197706097041095","No",,"http://cdn3.sportngin.com/attachments/photo/2893/4248/image_20789684302015607791_medium.png",,,,,
"Inland Empire Surf Soccer Club-Little Kickers","http://inlandempiresurf.com/","info@inlandempiresurf.com","3496 Little League Drive","San Bernardino","CA",92407,"SoCal","Jeana",9092379091,"nland Empire Surf Soccer Club announces the formation of its ""Happy Kickers"" program specifically designed for children aged 4-8 years old who are looking for a fun, high energy, positive hour of soccer! Our professional staff has planned a series of courses where young players can enhance their soccer skills while helping them with their overall growth, motor skills and confidence! The Happy Kickers courses are designed for children who are ready for a challenge while at the same time have fun with a group of children at his or her level. Classes are fun and fast paced while keeping the player focused on their balancing skills, coordination and teamwork! The Inland Empire Surf SC ""Happy Kickers"" program is held every Wednesday at the Surf Soccer Complex in San Bernardino.",4,8,"Yes","Yes","No","Soccer",,,,,,,,,25,"Per_month","Sportsaffinity","https://www.facebook.com/pages/Inlandempiresurfcom/139366139585505","No","http://inlandempiresurf.com/images/2013/home-1-1.jpg",,"Surf Soccer Complex in San Bernardino",,,,
"Socceroplis","http://www.socceropolis.com/",,"Clover Park & McKinley School","Santa Monica","CA",,"SoCal","Jeana","310-592-5707","SOCCEROPOLIS is a non-competitive introductory program which is designed to provide year-round soccer classes and camps for boys and girls ages 3 to 10. Children will learn the basic FUNdamentals of soccer such as: dribbling, trapping, passing, shooting, and play actual soccer games. This fast paced, energetic program will stimulate each child to build coordination, motor skills, balance and movement in a fun and safe environment. Our SOCCEROPOLIS program clearly understands the youth player and will certainly bring out their confidence and creativity through lessons taught on the field.",3,9,"Yes","Yes","Yes","Soccer",,,,,,,,,143,"Per_session","Phone only","N/A","N/A","http://www.socceropolis.com/images/new_header.gif","http://www.socceropolis.com/galleryphotos/th/53ae384a89eeb_IMG_3931.jpg","Clover Park, McKinley School",,,"Coach Milton","Yes"
